{"schema_version":"1.0.0-fixture","fixture":true,"operational":false,"production_status":"ACTIVE","production_health_percent":92,"original_scope_completion_percent":78,"authority":"PRODUCTION","summary":"Current public map, calendar, feeds, discovery and operator panels remain the active V1 system.","remaining_work":[{"title":"Finish remaining V1 technical debt","status":"IN_PROGRESS","detail":"Preserve visibility until V2 replacement gates pass."},{"title":"Maintain feed reliability","status":"ACTIVE","detail":"V1 remains authoritative for production event delivery."},{"title":"Preserve rollback path","status":"LOCKED","detail":"Retire only after approved V2 cutover."}]}